{
  "protocol": "xixi/1.0",
  "id": "msg_example_010",
  "type": "assistant.stream.start",
  "timestamp": "2026-07-30T01:10:00+08:00",
  "session_id": "ses_example_001",
  "trace_id": "trc_example_001",
  "reply_to": null,
  "source": "container",
  "target": "ui",
  "sequence": 10,
  "ack_required": false,
  "replay_safe": false,
  "payload": {
    "turn_id": "turn_example_001",
    "message_id": "assistant_example_001",
    "mode": "execution"
  }
}
