{
  "protocol": "xixi/1.0",
  "id": "msg_example_014",
  "type": "assistant.stream.interrupted",
  "timestamp": "2026-07-30T01:14:00+08:00",
  "session_id": "ses_example_001",
  "trace_id": "trc_example_001",
  "reply_to": null,
  "source": "container",
  "target": "ui",
  "sequence": 14,
  "ack_required": false,
  "replay_safe": false,
  "payload": {
    "turn_id": "turn_example_002",
    "message_id": "assistant_example_002",
    "scope": "all",
    "partial_text_saved": false,
    "task_resume_token": "resume_example_001"
  }
}
