{
  "protocol": "xixi/1.0",
  "id": "msg_example_006",
  "type": "permission.request",
  "timestamp": "2026-07-30T01:06:00+08:00",
  "session_id": "ses_example_001",
  "trace_id": "trc_example_001",
  "reply_to": null,
  "source": "container",
  "target": "ui",
  "sequence": 6,
  "ack_required": true,
  "replay_safe": false,
  "payload": {
    "turn_id": "turn_example_001",
    "permission_id": "perm_example_001",
    "operation": "上传并分析项目文件",
    "target": "external-model",
    "scope": {
      "attachment_ids": [
        "att_example_001"
      ],
      "file_count": 3
    },
    "risk": "outbound_private",
    "reason": "私人项目源代码将发送到外部服务",
    "options": [
      "allow_once",
      "allow_scope",
      "deny"
    ],
    "expires_at": null
  }
}
